{
  "job_id": "personal_sample_001",
  "doc_score": 0.5833,
  "claims": [
    {
      "cid": "c1",
      "kind": "relational",
      "text": "Corwin Mavik manages Jessa Minlow.",
      "status": "SUPPORTED",
      "cluster_flag": false,
      "grounding_ratio": 1.0,
      "dist_to_core": 0,
      "evidence": {
        "type": "support",
        "truth": "Jessa Minlow",
        "path": [
          "Corwin Mavik",
          "manages",
          "Jessa Minlow"
        ]
      }
    },
    {
      "cid": "c2",
      "kind": "relational",
      "text": "Arlen Veyro owns a pet named Bramble.",
      "status": "SUPPORTED",
      "cluster_flag": false,
      "grounding_ratio": 1.0,
      "dist_to_core": 0,
      "evidence": {
        "type": "support",
        "truth": "Bramble",
        "path": [
          "Arlen Veyro",
          "owns_pet",
          "Bramble"
        ]
      }
    },
    {
      "cid": "c3",
      "kind": "relational",
      "text": "Gavo Rellin lives in Dovemarsh.",
      "status": "SUPPORTED",
      "cluster_flag": false,
      "grounding_ratio": 1.0,
      "dist_to_core": 0,
      "evidence": {
        "type": "support",
        "truth": "Dovemarsh",
        "path": [
          "Gavo Rellin",
          "lives_in",
          "Dovemarsh"
        ]
      }
    },
    {
      "cid": "c4",
      "kind": "relational",
      "text": "Della Quorin was born in 1992.",
      "status": "CONTRADICTED",
      "cluster_flag": false,
      "grounding_ratio": 1.0,
      "dist_to_core": 0,
      "evidence": {
        "type": "conflict",
        "truth": "1990",
        "path": [
          "Della Quorin",
          "born_in",
          "1990"
        ]
      }
    },
    {
      "cid": "c5",
      "kind": "relational",
      "text": "Brisa Nalore is married to Corwin Mavik.",
      "status": "CONTRADICTED",
      "cluster_flag": false,
      "grounding_ratio": 1.0,
      "dist_to_core": 0,
      "evidence": {
        "type": "conflict",
        "truth": "Arlen Veyro",
        "path": [
          "Brisa Nalore",
          "married_to",
          "Arlen Veyro"
        ]
      }
    },
    {
      "cid": "c6",
      "kind": "relational",
      "text": "Mira Vell works at Aster Quay Group.",
      "status": "UNGROUNDED",
      "cluster_flag": false,
      "grounding_ratio": 0.5,
      "dist_to_core": 0,
      "evidence": {
        "type": "ungrounded",
        "truth": null,
        "path": []
      }
    },
    {
      "cid": "c7",
      "kind": "relational",
      "text": "Zavren Pell works at Cindrel Motive Office.",
      "status": "UNGROUNDED",
      "cluster_flag": true,
      "grounding_ratio": 0.0,
      "dist_to_core": null,
      "evidence": {
        "type": "ungrounded",
        "truth": null,
        "path": []
      }
    },
    {
      "cid": "c8",
      "kind": "relational",
      "text": "Ostia Kel works at Cindrel Motive Office.",
      "status": "UNGROUNDED",
      "cluster_flag": true,
      "grounding_ratio": 0.0,
      "dist_to_core": null,
      "evidence": {
        "type": "ungrounded",
        "truth": null,
        "path": []
      }
    },
    {
      "cid": "c9",
      "kind": "relational",
      "text": "Zavren Pell manages Ostia Kel.",
      "status": "UNGROUNDED",
      "cluster_flag": true,
      "grounding_ratio": 0.0,
      "dist_to_core": null,
      "evidence": {
        "type": "ungrounded",
        "truth": null,
        "path": []
      }
    },
    {
      "cid": "c10",
      "kind": "relational",
      "text": "Ostia Kel leads Project Sablewick.",
      "status": "UNGROUNDED",
      "cluster_flag": true,
      "grounding_ratio": 0.0,
      "dist_to_core": null,
      "evidence": {
        "type": "ungrounded",
        "truth": null,
        "path": []
      }
    },
    {
      "cid": "c11",
      "kind": "relational",
      "text": "Noll Varen leads Project Sablewick.",
      "status": "UNGROUNDED",
      "cluster_flag": true,
      "grounding_ratio": 0.0,
      "dist_to_core": null,
      "evidence": {
        "type": "ungrounded",
        "truth": null,
        "path": []
      }
    },
    {
      "cid": "c12",
      "kind": "relational",
      "text": "Noll Varen manages Zavren Pell.",
      "status": "UNGROUNDED",
      "cluster_flag": true,
      "grounding_ratio": 0.0,
      "dist_to_core": null,
      "evidence": {
        "type": "ungrounded",
        "truth": null,
        "path": []
      }
    }
  ],
  "graph": {
    "nodes": [
      {
        "id": "claim:c1",
        "label": "Corwin Mavik → manages → Jessa Minlow",
        "kind": "claim",
        "color": "green"
      },
      {
        "id": "ent:p_corwin_mavik",
        "label": "Corwin Mavik",
        "kind": "entity",
        "color": "green"
      },
      {
        "id": "ent:p_jessa_minlow",
        "label": "Jessa Minlow",
        "kind": "entity",
        "color": "green"
      },
      {
        "id": "claim:c2",
        "label": "Arlen Veyro → owns_pet → Bramble",
        "kind": "claim",
        "color": "green"
      },
      {
        "id": "ent:p_arlen_veyro",
        "label": "Arlen Veyro",
        "kind": "entity",
        "color": "green"
      },
      {
        "id": "ent:pet_bramble",
        "label": "Bramble",
        "kind": "entity",
        "color": "green"
      },
      {
        "id": "claim:c3",
        "label": "Gavo Rellin → lives_in → Dovemarsh",
        "kind": "claim",
        "color": "green"
      },
      {
        "id": "ent:p_gavo_rellin",
        "label": "Gavo Rellin",
        "kind": "entity",
        "color": "green"
      },
      {
        "id": "ent:city_dovemarsh",
        "label": "Dovemarsh",
        "kind": "entity",
        "color": "green"
      },
      {
        "id": "claim:c4",
        "label": "Della Quorin → born_in → 1992",
        "kind": "claim",
        "color": "red"
      },
      {
        "id": "ent:p_della_quorin",
        "label": "Della Quorin",
        "kind": "entity",
        "color": "green"
      },
      {
        "id": "ent:year_1992",
        "label": "1992",
        "kind": "entity",
        "color": "green"
      },
      {
        "id": "claim:c5",
        "label": "Brisa Nalore → married_to → Corwin Mavik",
        "kind": "claim",
        "color": "red"
      },
      {
        "id": "ent:p_brisa_nalore",
        "label": "Brisa Nalore",
        "kind": "entity",
        "color": "green"
      },
      {
        "id": "claim:c6",
        "label": "Mira Vell → works_at → Aster Quay Group",
        "kind": "claim",
        "color": "gray"
      },
      {
        "id": "mention:mira-vell",
        "label": "Mira Vell",
        "kind": "mention",
        "color": "gray"
      },
      {
        "id": "ent:org_aster_quay_group",
        "label": "Aster Quay Group",
        "kind": "entity",
        "color": "green"
      },
      {
        "id": "claim:c7",
        "label": "Zavren Pell → works_at → Cindrel Motive Office",
        "kind": "claim",
        "color": "orange"
      },
      {
        "id": "mention:zavren-pell",
        "label": "Zavren Pell",
        "kind": "mention",
        "color": "orange"
      },
      {
        "id": "mention:cindrel-motive-office",
        "label": "Cindrel Motive Office",
        "kind": "mention",
        "color": "orange"
      },
      {
        "id": "claim:c8",
        "label": "Ostia Kel → works_at → Cindrel Motive Office",
        "kind": "claim",
        "color": "orange"
      },
      {
        "id": "mention:ostia-kel",
        "label": "Ostia Kel",
        "kind": "mention",
        "color": "orange"
      },
      {
        "id": "claim:c9",
        "label": "Zavren Pell → manages → Ostia Kel",
        "kind": "claim",
        "color": "orange"
      },
      {
        "id": "claim:c10",
        "label": "Ostia Kel → leads_project → Project Sablewick",
        "kind": "claim",
        "color": "orange"
      },
      {
        "id": "mention:project-sablewick",
        "label": "Project Sablewick",
        "kind": "mention",
        "color": "orange"
      },
      {
        "id": "claim:c11",
        "label": "Noll Varen → leads_project → Project Sablewick",
        "kind": "claim",
        "color": "orange"
      },
      {
        "id": "mention:noll-varen",
        "label": "Noll Varen",
        "kind": "mention",
        "color": "orange"
      },
      {
        "id": "claim:c12",
        "label": "Noll Varen → manages → Zavren Pell",
        "kind": "claim",
        "color": "orange"
      }
    ],
    "edges": [
      {
        "src": "claim:c1",
        "dst": "ent:p_corwin_mavik",
        "rel": "SUBJ",
        "status": "supported"
      },
      {
        "src": "claim:c1",
        "dst": "ent:p_jessa_minlow",
        "rel": "manages",
        "status": "supported"
      },
      {
        "src": "claim:c2",
        "dst": "ent:p_arlen_veyro",
        "rel": "SUBJ",
        "status": "supported"
      },
      {
        "src": "claim:c2",
        "dst": "ent:pet_bramble",
        "rel": "owns_pet",
        "status": "supported"
      },
      {
        "src": "claim:c3",
        "dst": "ent:p_gavo_rellin",
        "rel": "SUBJ",
        "status": "supported"
      },
      {
        "src": "claim:c3",
        "dst": "ent:city_dovemarsh",
        "rel": "lives_in",
        "status": "supported"
      },
      {
        "src": "claim:c4",
        "dst": "ent:p_della_quorin",
        "rel": "SUBJ",
        "status": "contradicted"
      },
      {
        "src": "claim:c4",
        "dst": "ent:year_1992",
        "rel": "born_in",
        "status": "contradicted"
      },
      {
        "src": "claim:c5",
        "dst": "ent:p_brisa_nalore",
        "rel": "SUBJ",
        "status": "contradicted"
      },
      {
        "src": "claim:c5",
        "dst": "ent:p_corwin_mavik",
        "rel": "married_to",
        "status": "contradicted"
      },
      {
        "src": "claim:c6",
        "dst": "mention:mira-vell",
        "rel": "SUBJ",